{
  "$schema": "./reference-scenario.schema.json",
  "version": "1.0.0-design",
  "statusAsOf": "2026-10-27",
  "author": "resilience-lead (AI practice-lead agent). Expected outcomes written on 27 Oct 2026, before any engine run. Advises; the product owner approves (gate RQ1).",
  "note": "Five reference scenarios (owner decision D13). Each takes its shape from public material: an enforcement notice, a regulator statement, a provider incident report or regulator guidance. Answers that the public material does not state are scenario assumptions, listed per scenario. The scenarios are illustrative clients, never the named firms: no statement here describes the named firm's current controls. Expected outcomes follow the rules in DESIGN.md sections 4 to 9 and decision-matrix.json. The posture number is calibrated in RQ5 and is not predicted; the exposure level and the rating cap are.",
  "conventions": [
    "Answer values are the v2 option labels in DESIGN.md section 12.",
    "Facts use the Sovereign IQ fact ids (ent.flags, org.establishments, org.sector) plus ent.res_flags for REG-02.",
    "Obligation status rule (DESIGN.md 7.3): all asked checks meet and none unasked = met; no asked check meets or partly meets = not_evidenced; otherwise partly; nothing asked = not_assessed. Unknown counts as a failed check.",
    "Proven-versus-tolerance comparison: proven band lower than the tolerance band = meets; same band = partly; higher band or 'Not proven' = fails.",
    "Impact = cost per hour (client input, low-high) x hours between proven recovery time (AF-DR-01) and required RTO (EX-03); gap low = max(0, proven lower bound - RTO upper bound), gap high = proven upper bound - RTO lower bound.",
    "Exposure: 3 or more Critical = Severe (rating at most Fragile); 1 or more Critical, or 4 or more High = High (rating at most Managed); 1 or more High = Moderate; otherwise Low."
  ],
  "scenarios": [
    {
      "id": "RS1",
      "name": "UK retail bank under PRA SS1/21 and FCA SYSC 15A, after a failed platform migration run by a critical IT supplier (workshop mode)",
      "illustrative": true,
      "summary": "Shape from the FCA and PRA penalty against TSB (20 Dec 2022): an April 2018 migration to a new platform run by a critical third-party supplier failed; branch, telephone, online and mobile banking were disrupted, with some problems until December 2018. Here, a PRA-regulated retail bank whose main digital and branch banking service depends on one supplier's platform. Answers are scenario assumptions consistent with that shape.",
      "mode": "workshop",
      "sources": [
        { "kind": "regulator_enforcement", "citation": "FCA press release, 'TSB fined £48.65m for operational resilience failings' (20 Dec 2022)", "url": "https://www.fca.org.uk/news/press-releases/tsb-fined-ps4865m-operational-resilience-failings", "status": "V", "checked": "2026-10-27", "usedFor": "Shape only: PRA- and FCA-regulated bank; platform migration failure; critical third-party supplier; months of customer disruption. No figure from the notice is used as an input." },
        { "kind": "regulator_guidance", "citation": "PRA SS1/21 (March 2022), paras 2.10, 3.10-3.15, 4.12-4.16, 5.9, chapters 6 and 8", "url": "https://www.bankofengland.co.uk/-/media/boe/files/prudential-regulation/supervisory-statement/2021/ss121-march-22.pdf", "status": "V", "checked": "2026-10-27", "usedFor": "Obligation checks and dates (in force 31 Mar 2022; within tolerance no later than 31 Mar 2025)." },
        { "kind": "regulation", "citation": "FCA Handbook SYSC 15A.2.1R, 15A.2.5R, 15A.2.9R, 15A.4.1R, 15A.5.3R, 15A.6.1R", "url": "https://www.handbook.fca.org.uk/handbook/SYSC/15A/", "status": "V", "checked": "2026-10-27", "usedFor": "Obligation articles." },
        { "kind": "regulation", "citation": "FCA PS26/2 and PRA PS7/26, operational incident and third-party reporting (published 18 Mar 2026; apply from 18 Mar 2027)", "url": "https://www.fca.org.uk/publications/policy-statements/ps26-2-operational-incident-third-party-reporting", "status": "V", "checked": "2026-10-27", "usedFor": "Dated obligation shown as 'applies later'; reporting is assessed in Sovereign IQ." }
      ],
      "inputs": {
        "facts": { "ent.flags": ["uk_pra_regulated"], "org.establishments": ["uk"], "org.sector": "banking", "ent.res_flags": ["none"] },
        "enterpriseAnswers": {
          "EX-12": "Some non-critical single points of failure", "EX-13": "Yes, documented", "EX-14": "Yes, exercised", "EX-15": "Yes, periodic review",
          "EX-18": ["On-premises", "Azure", "SaaS"], "EX-19": "Yes, documented, not tested", "EX-20": "Documented, not fully tested",
          "AUD-01": "1-3 years ago"
        },
        "services": [
          {
            "service": "S1",
            "name": "Retail digital and branch banking",
            "answers": {
              "EX-01": ["Customer-facing services", "Revenue-generating services"], "EX-02": "4-24 hours", "EX-03": "1-4 hours", "EX-04": "<15 minutes", "TOL-02": "<15 minutes", "TOL-03": "Defined in words only",
              "EX-05": "Partially", "EX-06": "Likely, but not recently tested", "EX-07": "1-2 years ago", "EX-08": "No - isolated by design, not tested",
              "EX-09": "Immutable, restore not tested", "EX-10": "Yes, with no viable alternative", "EX-11": "High concentration", "EX-16": "Technical tests only", "EX-17": "Documented and reviewed, not tested",
              "AF-DR-01": "4-24 hours", "AF-DR-02": "15-60 minutes", "AF-DR-04": "Partially", "AF-DR-05": "Partially automated",
              "AF-TP-02": "High - no practical alternative", "AF-TP-03": "Weeks/months", "EXIT-01": "Plan documented, not tested",
              "AF-TS-02": "Partially", "REV-01": "Within 12 months", "DC-01": "Configured, not tested", "SAAS-01": "Provider-native retention only"
            },
            "costPerHour": { "currency": "GBP", "low": 400000, "high": 1200000 }
          }
        ],
        "assumptions": [
          "All answers are scenario assumptions consistent with the public shape; none describes TSB's current controls.",
          "Cost per hour GBP 400,000-1,200,000 is a scenario input standing in for the client's own estimate; it is not derived from the penalty or redress figures."
        ]
      },
      "expected": {
        "regimes": [
          { "regime": "UK_OPRES", "grade": "applies", "why": "Sovereign IQ rule UK_OPRES.1: ent.flags includes uk_pra_regulated." }
        ],
        "services": [
          {
            "service": "S1",
            "ladder": {
              "status": "issued", "rtoRung": "DR-02", "rpoRung": "DR-03", "rung": "DR-03", "alternativeBelow": "DR-02",
              "controlsAdded": ["RES.BACKUP.PITR", "RES.DATA.REPLICATION", "RES.CYBER.ISOLATION", "RES.BACKUP.IMMUTABLE", "RES.CYBER.CLEANROOM", "RES.IDENTITY.RECOVERY", "RES.DR.SEPARATION", "RES.TP.CONCENTRATION", "RES.DEPENDENCY.MAP", "RES.DR.ORCHESTRATION", "RES.TP.EXIT", "RES.TP.CONTINUITY", "RES.SAAS.BACKUP"],
              "why": "RTO 1-4 hours gives pilot light; RPO under 15 minutes gives warm standby; the higher is warm standby. RTO is within the 4-24 hour tolerance, so no consistency rule applies. Pilot light, one rung down, would not reliably meet an RPO under 15 minutes."
            },
            "topFindings": [
              { "control": "RES.DR.SEPARATION", "severity": "Critical", "why": "High concentration (EX-11) and recovery partly sharing the same failure domain (AF-DR-04): recovery may fail with production (G-04)." },
              { "control": "RES.DR.STRATEGY", "severity": "High", "why": "Proven recovery 4-24 hours against a 1-4 hour RTO, and proven RPO 15-60 minutes against under 15 minutes. Same band as the tolerance, so a tolerance breach is not shown; High, not Critical.", "obligations": ["UK_OPRES.WITHIN_TOLERANCE"] },
              { "control": "RES.TP.EXIT", "severity": "High", "why": "Critical supplier with no viable alternative (EX-10, AF-TP-02); exit plan documented but never tested (EXIT-01); exit would take weeks or months (AF-TP-03)." },
              { "control": "RES.TEST.SCENARIO", "severity": "High", "why": "Only technical tests (EX-16); tests only partly measure against the impact tolerance (AF-TS-02).", "obligations": ["UK_OPRES.SCENARIO_TESTING"] },
              { "control": "RES.DR.PROVEN", "severity": "High", "why": "Immutable backups whose restore has not been tested (EX-09, R9 decision 3), last end-to-end test 1-2 years ago (EX-07)." },
              { "control": "RES.CYBER.ISOLATION", "severity": "High", "why": "Recovery isolated by design but never tested (EX-08)." },
              { "control": "RES.IDENTITY.RECOVERY", "severity": "High", "why": "Break-glass path documented, not tested (EX-19)." },
              { "control": "RES.DEPENDENCY.MAP", "severity": "High", "why": "Service only partly mapped (EX-05).", "obligations": ["UK_OPRES.MAPPING"] }
            ],
            "impact": { "shown": true, "currency": "GBP", "costPerHour": [400000, 1200000], "gapHours": [0, 23], "range": [0, 27600000] }
          }
        ],
        "headline": { "criticalExposure": "High", "ratingCap": "Managed", "capReasonMentions": ["recovery may fail with production"], "provisional": false },
        "obligations": [
          { "obligation": "UK_OPRES.IBS", "status": "met", "why": "Service identified (EX-01) and reviewed within 12 months (REV-01)." },
          { "obligation": "UK_OPRES.TOLERANCE", "status": "met", "why": "Time-based tolerance set (EX-02), as SS1/21 3.11 requires." },
          { "obligation": "UK_OPRES.WITHIN_TOLERANCE", "status": "partly", "why": "EX-06 'likely' (partly) and proven recovery in the same band as the tolerance (partly)." },
          { "obligation": "UK_OPRES.MAPPING", "status": "partly", "why": "EX-05 'Partially'." },
          { "obligation": "UK_OPRES.SCENARIO_TESTING", "status": "partly", "why": "EX-16 technical tests only; AF-TS-02 partially." },